consumerid,Sex,ethnicity,Race,Age
111013198531,Female,"No, Not Hispanic, Latino/a, or Spanish origin",White,31
111013208632,Male,Patient declined to respond,Patient declined to respond,36
111013213095,Female,Hispanic or Latino,None of the above,25
111014123456,Female,African American,Asian,
111013225659,Male,"No, Not Hispanic, Latino/a, or Spanish origin",Asian,27
111013235506,Female,"No, Not Hispanic, Latino/a, or Spanish origin",Bajoran,31
111013238188,Female,Hispanic or Latino,Bajoran,190